article_id,country,date,URL,title,article_text
1,South Africa,28 July 2024,https://www.businessday.co.za/bt/opinion/2024-07-28-insurance-industry-must-change-with-the-climate/,JOHAN VAN GREUNING: Insurance industry must change with the climate,"Protection gap remains significant concern for industry, particularly when it comes to recovery of losses following severe weather-related event.  The insurance industry is facing a growing challenge: over the years we have seen a rise in the frequency and severity of extreme weather events attributed to the climate crisis. In 2023 about 240 climate-related events were recorded globally. In South Africa we are seeing this devastating trend of heavy flooding across different provinces, ravaging homes, properties and vehicles and changing lives instantly. More concerning is the loss of life, which usually has long-lasting implications on family dynamics. Earlier this year, South African researchers predicted 2024 would be a year of “climate and extreme weather events”. It’s safe to say that the climate is not changing; it has changed. The effects are tangible, and the impact is real. According to a 2023 report by Munich RE, global losses due to natural disasters were estimated at $270bn (about R5-trillion) and insured losses were roughly estimated at $120bn in 2022, one of the highest economic losses ever recorded. In South Africa, the KwaZulu-Natal floods of April 2022 were noted as the largest flooding event on the continent with an economic loss of $3.6bn. The most concerning part is the fact that only 18% of those losses were insured. In 2023, it was reported that insurers paid out about R35m in claims for the damage caused by the hailstorms in November. While it can’t be predicted what kinds of catastrophes we can expect in the future, we do know we are experiencing changes in weather patterns, and we need to adapt, anticipating these future storms. As the world changes to adapt to adverse climate events and new weather patterns, the insurance industry has had to do the same. Over the last decade, there have been significant structural changes in the global insurance industry, driven by the unprecedented new risk factors that will be impossible to ignore. The protection gap remains one of the significant concerns for the industry, particularly when it comes to the recovery of losses following a severe weather-related event. Climate-related events can have profound effects on individuals and what matters to them. They affect their financial stability, daily lives, emotional wellbeing, community cohesion and sense of safety. While it can’t be predicted what kinds of catastrophes we can expect in the future, we do know we are experiencing changes in weather patterns, and we need to adapt, anticipating these future storms. The devastating storms have the potential to drive individuals and communities towards prioritising safety measures, seeking support, and advocating for change. However, we can’t ignore the fact that we are living through tough economic times. Not only have we seen clients cancelling subscriptions, but price-sensitive consumers are downgrading or shifting to lower-priced brands and products. The future of the insurance industry will depend on its ability to be adaptable, modular and customisable so as to insure more people. In these tough economic times, this will help consumers prioritise what is most important to them and prevent the underinsurance of certain assets. While the most noticeable positive impact of insurance is experienced through the recovery of losses, the industry is not just limited to compensation. Insurance plays a proactive role in risk management and prevention — potentially the most significant role in helping consumers protect what matters most to them. Insurers also need to contribute to a better understanding of risks through advanced risk models and promote risk awareness by offering tailored terms and advice to policyholders. By understanding the effects of changing weather patterns, individuals can make informed decisions, seek appropriate support and actively contribute to building a more resilient future. The calamities brought on by the environmental challenges highlight a need for intentional collaboration between players to safeguard the sustainable growth of Africa’s economy. Recognising that vulnerable communities are often the hardest hit by climate-related disasters, it is critical to enhance the adaptive capacity of communities. The industry could work with municipalities to help integrate early warning systems for communities. By providing financial protection, promoting risk reduction measures, and fostering collaboration, the industry can help safeguard Africa’s growth and contribute to a sustainable and resilient future for the continent. Insurance can be seen as a force for good.  The critical role in economic growth cannot be overstated, as it ensures stability, resilience, and the ability to recover from climate-related events, ultimately driving sustainable and inclusive development. • Van Greuning is head of Standard Insurance"
2,South Africa,24 March 2024,https://www.businessday.co.za/bt/opinion/2024-03-24-zandile-makhoba-climate-change-turns-up-the-heat-on-inflation/,ZANDILE MAKHOBA: Climate change turns up the heat on inflation,"High interest rates are adding to the temperatures and are being felt all over the economy It is hot in South Africa. The hottest it has been in decades. The impact of El Niño is an uncontrollable factor that the country is dealing with and comes as a blow to the consumer inflation outlook. The heat is disrupting agriculture, after weak production in 2023. Food prices have been a major contributor to the stubborn CPI (consumer price index) inflation rate. In the February report, food prices contributed a notable 1.1% of overall inflation. With the prevailing weather conditions, it suggests that food prices will remain on the rise for much of the year. CPI inflation reached 5.6% in February 2024, the fifth consecutive reading above 5.0%, showing amber on the ceiling of the Reserve Bank’s target range. It is not just the weather that has become unbearable. The high interest rate environment is adding to the heat and is being felt across the economy: the National Credit Regulator has reported a rising number of credit application rejections and a rise in credit impairment in its latest “Consumer Credit Market Report”. Retail sales contracted further in the first month of 2024, maintaining the trend of 2023, and motor trade sales growth was weak. If it has not been said enough times already this year, pressure is on in this economy, where household consumption expenditure accounts for around two-thirds of GDP. When inflation is driven by exogenous factors, it often triggers that age-old debate about monetary policy and inflation targeting. It is (now) a global lament: what is the use of hiking rates if it hardly moves inflation and just erodes disposable income, harming the economy? In Pretoria, Sandton and Cape Town it is an academic or ideological debate, but at the household level across the country it is more of a socioeconomic, and even political, trigger. I raise this point to highlight how easy it is for one thing, such as climate change, to trigger multifaceted risks and tensions in the economy that cannot handle another degree of tension. Scarcity and pricing go hand in hand. And enough scarcity triggers social instability. Developed economies did one other thing than hike rates when prices spiked unexpectedly in the midst of Covid and then later in response to geopolitical conflict: they deglobalised by looking to insource as much as possible. It’s a valuable solution if you can internally produce everything the country needs, until the sun comes along and dries up all the food.  Most countries, however, cannot completely deglobalise even if they wanted to. South Africa is one of them. Managing prices is complex, but if we view it more as managing scarcity there are so many more levers than monetary policy and inflation targeting: managing the exchange rate plays a role, trade relations play a role, stimulating the internal economy plays a role, and so does addressing (or at least planning) for climate change. Maybe what we need is a more co-ordinated effort around these levers. The lever that may not be getting much attention in the South African context, is that of responding to climate change. Ask anybody if they’d have another coal power station tomorrow or what many view as the experimental renewable energy solutions under way, and you can guess the answer. This kind of thinking goes beyond the power situation; too many South Africans are burdened with the struggle of meeting their immediate needs: food, housing, energy and transportation (driven by fuel prices). These are all major drivers of consumer inflation today because their supply has been disrupted in one way or another: food by climate and animal disease; housing by rapid urbanisation, interest rates and natural and unnatural disasters; energy by poor infrastructure planning and maintenance at Eskom; and transport by the exchange rate and oil production interruptions. They also all have some level of environmental impact, which directly and negatively affects a range of basic necessities when unmanaged, resulting in higher prices for those basics in future. As the saying goes, it is difficult to see the future when you are hungry today. But if there is one lesson we are learning from our energy crisis, it is that failing to have foresight makes today’s problems worse tomorrow. Is business doing enough? Is the government doing enough?  And are we doing enough to make our communities appreciate the importance of sustainability to our socioeconomic longevity? • Makhoba is an economist, and the lead specialist of research and analytics at Liberty, the  insurance and asset management arm of Standard Bank."
3,South Africa,08 June 2025,https://www.businessday.co.za/bt/business-and-economy/2025-06-08-reserve-bank-must-deal-with-climate-risks/,Reserve Bank 'must deal with climate risks',"Deputy governor says COP30 meeting in Brazil will be crucial for world's response to climate change. The COP30 meeting in Belém, Brazil, this November will be critical to the agenda for responding to weather-related risks, according to South African Reserve Bank deputy governor Fundi Tshazibana. Speaking at a fireside chat at the University of Stellenbosch on Friday, Tshazibana, who is also CEO of the Bank's Prudential Authority, said the meeting is expected to set the tone for future climate discussions and interventions. “In the work that we are doing with the body of central banks, I think there is broad recognition that there are climate-related risks that must be dealt with. There might be differences and nuances around the terminology. The biggest test globally will be to see whether, when we have the COP later this year, the posture is going to change.” Tshazibana was addressing the University of Stellenbosch on green energy financing. Her remarks come amid the decision of US President Donald Trump's administration to pull out of the Paris Agreement on climate change, which includes the reduction of carbon emissions. She said that there remained a commitment by central banks, through various platforms including South Africa’s presidency of the G20 this year, to secure solutions that will seek to respond to climate change and mitigate its effects. “The commentary is around climate change. Should we be calling it climate change, or should we talk about weather-related risks? Now, I don’t get too fixated on terminology because if we start to look at terminology, we sort of miss the stuff in between.” Tshazibana said central banks across various jurisdictions, including the Reserve Bank, had a keen understanding of their mandates and limits and were generally dynamic in using their mandates to help governments achieve broader aims. “If I talk to my US counterparts — because I am also a supervisor of insurers — the insurers are dealing with the risks they going to deal with. Chairman [of the US Federal Reserve] Jerome Powell has said the US recognises that there are risks from weather-related events. “But, in his view, that is not a mandate that sits with the central bank. It sits with other agencies, and there are interventions that those other agencies are putting in place to deal with and manage the weather-related risks.” Tshazibana said South Africa was a water-stressed region that experienced high levels of drought, which had an inflationary impact on food prices — in the order of 10 percentage points and three percentage points on overall inflation. “When we ask banks how many of their credit risk exposures are to companies that might be exposed to climate-related risks, they say between 35% and 60%. That’s a large number in terms of how the books of a bank might be affected. “If we look at the floods we experienced in KwaZulu-Natal in 2022, the estimated economic cost was about R54bn. I haven’t even gone to the insurance-related costs. So from a central banking point of view, you can estimate that there are risks, there is a pricing that you can place on them.” Also on Friday, the department of electricity & energy and the National Treasury announced that progress was being made in the public-private initiative to “rewire the country’s transmission infrastructure, unlock billions in infrastructure investment, and anchor industrial renewal”. “South Africa’s energy transition and economic recovery agenda hinges on the rapid expansion and modernisation of its transmission infrastructure. The Integrated Resource Plan 2019 and Eskom’s Transmission Development Plan estimate that more than 14,000km of new transmission lines will be required in the next decade to accommodate an additional 53GW of generation capacity,” they said in a statement. The statement said the current grid expansion pace was wholly inadequate, meaning that South Africa needed a minimum of 1,400km ayear for energy security requirements. Also addressing the Stellenbosch event, Lilas Demmou, the head of the South Africa desk at the Organisation for Economic Co-operation and Development (OECD), said South Africa had the lowest employment rate compared to OECD countries and big emerging economies, and the country’s share of renewables in supply was lower than average. “Renewables have a key role to play. By increasing renewables, you will be able to ensure, once and for all, energy security and also progress towards the transition,” Demmou said. Renewables have a key role to play. By increasing renewables, you will be able to ensure, once and for all, energy security and also progress towards the transition. She urged South Africa to relax the regulatory framework to promote competition and open participation in the energy market. She added that the country had one of the least competition-friendly frameworks when compared with OECD markets. “To take care of this challenge, we make two types of recommendations. Some are short-term recommendations, because it takes a bit of time to establish fully in a new regulatory framework, including maximising what we can get from IPP [independent power producers]. “This needs to be done now to increase supply from renewables, and in the medium-term the main objective is to establish and implement a competitive wholesale market, to have the full independence of the transmission company and progression in the competition in retail.” Katie Hill, partner and associate director for climate at BCG, Nairobi, said that aside from the need to improve macroeconomic conditions in African economies, various solutions existed to unlock financing from investors, development finance institutions, multilateral organisations and philanthropic funders. “A major step that investors and DFIs [development finance institutions] can take is to increase portfolio value creation to accelerate growth and derisk green companies, which will ultimately bring down the cost of capital. “Regarding debt, fortunately, a spectrum of financial instruments is available, ranging from traditional to novel, that can effectively derisk and mobilise debt into green sectors in Africa. By using these instruments, the availability and affordability of capital can be enhanced, further supporting the growth of green sectors.” Warren Chetty, MD and partner at BCG, recommended bolstering policy to enhance the propensity of green energy projects to draw capital. “Sufficient resourcing and policies must be appropriately developed in these areas so that structured financing instruments can be scaled to increase the availability of capital and reduce costs. Private debt is particularly important for green sectors, which are more infrastructure- and working capital-intensive.”"
4,South Africa,22 June 2025,https://www.businessday.co.za/bt/opinion/2025-06-22-bjorn-lomborg-south-africa-should-not-follow-wests-example-on-climate-and-development/,BJORN LOMBORG: South Africa should not follow West's example on climate and development,"Being smart about climate change also means that governments will have more resources to invest in solving other important challenges. In recent years climate anxiety has taken over many Western governments and most international organisations. The result has been ruinous policies that help little but undermine future prosperity needed to deal with a host of other problems. Fortunately, South Africa can avoid repeating these mistakes. Climate change is a man-made problem, but campaigners and irresponsible politicians have distorted this out of all proportion and now falsely call it an existential threat that could eradicate humanity. This exaggeration grossly misrepresents the science in the UN Climate Panel reports. Moreover, it is repudiated by the world’s leading climate economists, including the only one to win the Nobel Prize. The cost of no further action on climate is equivalent to lowering GDP by 2-3% by century’s end — a problem, not the end of the world. Yet incessant scare stories have driven some Western governments to enact immensely costly policies. The UK has gone further in climate policies over the past two decades than nearly any other country. As a result, the inflation-adjusted electricity price, weighted across households and industry, has tripled from 2003 to 2023. By comparison, the US electricity price has remained almost unchanged over the same period. At the same time, the rich world is increasingly realising that it faces many other expensive challenges, including an ageing population bringing higher pension and healthcare costs, crumbling infrastructure, poor educational outcomes and a need for larger defence spending. Yet the EU has committed itself to net zero carbon emissions by 2050, which will cost over 10% of its GDP, or €3.3-trillion (R68-trillion) annually. This is more than today’s entire core spending across all 27 countries on health, education, police, courts, prisons, defence and the environment. South Africa should not repeat the mistakes made by Western countries by diving headlong into ineffective climate policies. It has a record of huge achievements, vast potential, and — like every other country — myriad complex challenges. It’s important that South Africa gets the balance right between the challenges and opportunities in front of it. A considered, balanced response to climate change means rolling out solar and wind in the areas where that is sensible, while realising that the longer-term solution to climate change must be innovation. We will not solve climate change by joining the British, being poorer, colder and with less power In 1970, when hunger stalked 35% of the developing world, the answer was not making the whole world eat less to redistribute food. It was innovation through the Green Revolution, which dramatically increased yields and brought better varieties and more fertiliser. Likewise, we will not solve climate change by joining the British, being poorer, colder and with less power. Instead, the leading industrial nations that are responsible for the majority of carbon emissions need to ramp up innovation in future generations of low-carbon energy. Once they innovate clean energy so that it is cheaper than fossil fuels, everyone will be able to switch. Finally, poverty alleviation is a crucial part of the response to climate change. Lifting people out of poverty reduces their vulnerability to climate shocks like heatwaves or hurricanes. Moreover, wealthier, more prosperous societies can afford better protection from the elements, along with better nutrition, healthcare and social protection. Wealthy countries can spend more on environmental protection, and all other good things. Being smart about climate change also means that governments will have more resources to invest in solving other important challenges. One such investment: We should boost maternal and newborn health through a simple package of basic emergency obstetric care and more family planning. Globally, this could save the lives of 166,000 mothers and 1.2-million newborns every year, delivering an astounding R87 in social benefits for each rand spent. Another phenomenal investment: agricultural R&D to help South Africa’s farmers become more efficient. Globally, a modest investment of $5.5bn (R99bn) annually could go a long way and free 133-million people from hunger. In total, prioritising the 12 best policies for development around the world could save 4.2-million lives every year and generate $1.1-trillion in economic benefits at a cost of just $35bn (R632.86bn) a year. South Africa has immense possibilities ahead, if it can seize the opportunity to invest wisely and judiciously. It should avoid the singular climate-focus of some Western countries and invest based on rigorous economic science in areas where it can make the most impact and the greatest progress. • Lomborg is president of the Copenhagen Consensus, visiting fellow at Stanford University’s Hoover Institution, and author of False Alarm and Best Things First."
