article_id,country,date,URL,title,article_text
5,South Africa,27 July 2025,https://www.businessday.co.za/bt/opinion/2025-07-27-sasha-cook-no-time-to-blow-hot-and-cold-over-climate-change/,SASHA COOK: No time to blow hot and cold over climate change,"We have the opportunity to make a lasting difference. We cannot fail to meet this challenge, lest we put future generations at risk In recent times we have seen a significant increase in natural hazards and volatility in weather across the world. South Africa has not been immune to the adverse impacts. Entering the second half of the year offers an opportunity to reflect on our ever-evolving climate and the need to talk about how we are adapting. Importantly, we need to talk about how we move forward in finding innovative financing solutions to build resilience in our communities. According to the World Meteorological Organisation “State of the Climate in Africa 2024” report, our continent has been, and will continue to be, disproportionately affected by climate change and the associated high costs required to fund essential climate adaptation and build resilience. The same report highlights that costs associated with climate change can be as much as 5% of the continent’s GDP and many are allocating up to 9% of their annual budgets to respond to climate extremes. It is therefore essential that the public and private sectors shift their focus and prioritise adaptation and resilience, alongside mitigation. We need to continue to focus on climate mitigation projects such as funding cleaner energy sources and decarbonisation activities. Equally, we need to consider how we reduce vulnerability to the negative impacts of climate change. This climate adaptation finance includes investments in climate-smart agriculture such as drought-resistant crops or improved water management, investment in infrastructure such as flood defences and early warning systems, energy storage systems and development of resilient buildings. Financing these activities improves resilience of economies and communities to floods, drought and other extreme weather events. Addressing climate-related impacts, and specifically prioritising adaptation and resilience, is a moral and business imperative. Based on various reports, including British International Investment’s “Emerging Economies Climate Report” of 2023, the business cost associated with climate change for Africa is undisputable. According to the BII report, 79% of respondents said climate change is impacting their organisation today, up from 68% in 2022, with flooding, drought and heat noted as the top physical risks. Business and finance need to invest in our assets, infrastructure and communities to ensure we can better withstand these risks Business and finance need to invest in our assets, infrastructure and communities to ensure we can better withstand these risks. This is not, however, an easy call to action. There are many challenges in scaling up financing for adaptation and resilience, such as a lack of clear revenue streams, insufficient and inaccurate data and a lack of expertise. Among some of the newer thinking in addressing financing gaps are initiatives such as using revenue streams from carbon credits or from associated eco-tourism to fund adaptation projects. Similarly, blended finance solutions are essential in bringing together multiple players with differing risk appetites and mandates to fund some of these critical projects that may not be commercially bankable on a stand-alone basis, and index based (parametric) insurance can be applied to mitigate physical risks. In the words of composer and economist W Edwards Deming: “In God we trust. All others must bring data.” While adaptation is a relatively new concept for many governments, data will be a foundational building block for any adaptation strategy. Better data, modelling tools and geolocation data will be essential for comprehensive solutions. We will need a measure of boldness and visionary leadership to drive a step-change in conventional business considerations. In pursuit of an integrated considered approach and to paraphrase Voltaire, “we should not let perfect be the enemy of the good”. As most readers will know, South Africa holds the presidency of the G20 this year and is effectively using the global convening platform to drive key initiatives that make adaptation a norm rather than an exception. Multilateral organisations and forums have a key role to play in driving systemic and behavioural changes. The scale of the challenge is too big for any one participant to solve alone. Gatherings such as COP30, G20 and the Sadc sustainable finance forum (among others) must serve as catalysts for innovation, action and target-setting. It is crucial for African countries to make our voices heard in these forums, given the scale of the challenges faced by our continent. We have the opportunity to make a lasting difference. We cannot fail to meet this challenge, lest we put future generations at risk. • Cook is head of sustainable finance at Standard Bank Corporate & Investment Banking"
6,South Africa,20 March 2022,https://www.businessday.co.za/bt/business-and-economy/2022-03-20-major-banks-under-pressure-to-lead-the-way-in-reducing-impact-of-climate-change/,Major banks under pressure to lead the way in reducing impact of climate change,"Africa's biggest lender, Standard Bank, this week announced plans to achieve net zero carbon emissions from its operations by 2040 and from its portfolio of financed emissions by 2050, joining global banks that have moved to mitigate the impact of climate change. Africa's biggest lender, Standard Bank, this week announced plans to achieve net zero carbon emissions from its operations by 2040 and from its portfolio of financed emissions by 2050, joining global banks that have moved to mitigate the impact of climate change. Lenders and institutional investors are coming under pressure to lead the charge on reducing emissions as the burning of fossil fuels threatens a climate change catastrophe. Standard Bank said it would mobilise up to R300bn for sustainable finance by the end of 2026, including R50bn for renewable energy, and the underwriting of a further R1bn for renewable energy by the end of 2024. Speaking at the release of the report, the CEO of Standard Bank’s Corporate and Investment Banking, Kenny Fihla, said climate targets include ceasing  finance of new oil-fired power plant construction or expansion of existing oil-fired power plants, except where the plants provide support services as part of an integrated renewable energy power plant. In terms of thermal coal, the bank is saying no to financing the construction of new coal-fired power plants or the expansion in generating capacity of existing coal-fired power plants. If Eskom were to say we want to expand the capacity of an existing coal-fired power plant, we will say no. It is as simple as that. —  Kenny Fihla, CEO of Standard Bank’s Corporate and Investment Banking “If Eskom were to say we want to expand the capacity of an existing coal-fired power plant, we will say no. It is as simple as that. But if Eskom were to say we want to convert an existing coal-fired power plant to gas, we will consider that because that will significantly reduce carbon emissions because gas is about 50% of the carbon emissions of coal. “We will be deliberate in asking what the money [is] for so we make the right call on the use of funds,” he said. Fihla said the financing of new coal mines in Southern Africa will occur only when “there is an overall positive environmental impact”. However, Omar Elmawi, co-ordinator of the #StopEACOP coalition, said it is hard to imagine any positive environmental impact from coal mines. “The emissions and other environmental impacts associated with opening a new coal mine to provide feedstock for an existing power plant — especially where coal-fired power is neither least-cost nor required for energy security — would clearly outweigh any claimed 'positive environmental impact'.” Absa, the country’s fourth-largest bank by market value, said its Corporate and Investment Bank unit aims to finance R100bn worth of environmental, social, and governance (ESG)-related projects by 2025, and Relationship Banking plans to finance R2.5bn or 250MW of embedded power in SA by 2025. Absa’s interim financial director, Punki Modise, said sustainable finance offers a significant growth opportunity: “It's not just funding, but [will] also give concessions to support corporates as they transition out of current energy to more clean sources.” In its report “Major Banks Analysis”, which looked at the 2021 financial performance of SA's four major banks, PwC said responding to evolving social and regulatory expectations to climate risk and ESG-related topics is a high priority. “As financial intermediaries and risk managers, banks will play a key role in facilitating an orderly energy transition as economies, markets and companies adapt to evolving climate policy. At the same time, they will seek to service the wide-ranging ESG needs of clients and the growing investor appetite for ESG products, evidenced by several ‘green-bond’ issuances that the major banks undertook in full-year [2021],” PwC said. Absa, Standard Bank, Nedbank and First Rand Bank all released their financial results this month, with PwC saying that the groups delivered strong results on the back of a rebound in economic activity, increased client engagement levels and gains made through the execution of their digitally-centric strategies. Combined headline earnings were R86.8bn, an increase of 99% against full-year 2020, while combined return on equity was 15.9% compared to 8.3%, credit loss ratio was 74 basis points from 180, said PwC. PwC Africa Banking Partner Rivaan Roopnarain said after consecutive periods of significant uncertainty, the major banks are optimistic that the rebound in economic activity and consumer confidence will gather momentum. “Further embedment of digital innovation and ESG-related metrics into reporting and performance measures are likely to remain important elements of overall bank strategy.” Craig Pheiffer, Sasfin Wealth chief investment strategist, said the big four banks have all posted results that reflect a similar core trend. These results have all been about the 2021 economic recovery from a pandemic-induced 2020 recession. “The recovery has broadly entailed a big jump in earnings, a strong rebound in dividend payments, much lower impairment charges and credit loss ratios, much higher returns on equity and improved capital adequacy (from a fairly strong position already)"", he said"
7,South Africa,31 July 2022,https://www.businessday.co.za/business-times/business/2026-01-31-richards-bay-terminal-operator-sees-a-rosy-future-as-coal-bounces-back/,SA’s first climate change bill must have the power to tackle non-compliance in greenhouse gas emissions,"If passed, the bill will form an integral part of environmental law framework and have far-reaching effects on government and business The UN Intergovernmental Panel on Climate Change published its Sixth Assessment Report, also known as AR6, earlier this year. The Guardian newspaper called AR6 the panel's “starkest warning yet” while UN secretary-general António Guterres described it as a “code red for humanity”. The AR6 warned that unless substantial and immediate reductions in greenhouse gas emissions are made, the goals agreed by the international community under the 2015 Paris Agreement, which SA has ratified, would not be reached. The Paris Agreement set a goal of keeping the global rise in temperature to well below 2°C and ideally to under 1.5°C above pre-industrial levels. Signatories must determine, plan, and report on their nationally determined contributions (NDC) — national climate change mitigation plans and policies which include targets for greenhouse gas emissions reductions. SA is the world's 14th largest emitter of greenhouse gases and the largest emitter in Africa. This can be attributed in part to its heavy reliance on Eskom's coal-fired power plants, which produce more than 80% of the country's electricity and accounts for 42% of its greenhouse gas emissions. There are growing calls for Eskom's ageing and failing grid to be supplemented with renewable energy, given SA's excellent opportunities for wind and solar energy — one of the best in the world. A report developed by researchers at Stellenbosch University envisions the installation of 5GW of renewable energy each year until 2050 to alleviate the pressure on Eskom and to support a just transition to a low-carbon economy. While SA has made tremendous strides in its climate change response, its mitigation efforts have been described as “insufficient” and require substantial improvements to meet the Paris Agreement 1.5°C goal. At present, SA is highly reliant on international financing for implementation of its climate change mitigation goals. Last year, donor governments pledged $8.5bn (about R143bn) towards SA's just energy transition at COP26 in Glasgow — but SA requires about $250bn to effectively transition to a low-carbon economy. As a developing economy with low economic growth, high levels of unemployment and a widening poverty gap, a high reliance on coal and a haemorrhaging national electricity provider, SA faces significant challenges in transitioning to a low-carbon economy. However, as a significant greenhouse gas emitter and a leading economy in Africa with constitutionally entrenched environmental rights, SA has an important role to play in addressing climate change and has recently taken several steps to bolster its response. The September 2021 revised NDC contained updated emissions targets for SA. In 2019, SA passed the Carbon Tax Act. Emitters meeting certain thresholds are required to pay tax, but there are significant allowances (up to 95%) which limit the scope of the act. The Presidential Climate Commission, which was formed in December 2020, also published the Just Transition Framework on May 27 2022, which aims to address the social and economic consequences of the country's climate change policies, particularly on its most vulnerable communities. On February 18 2022, the minister of the environment, forestry & fisheries introduced the Climate Change Bill, which is a reworked version of an earlier 2018 draft. It aims to co-ordinate SA's climate change response in accordance with the principles of co-operative governance; to build social and economic resilience to climate change; to ensure a just transition to a low-carbon economy; and to give effect to the country's international climate change commitments. The bill is being considered by the National Assembly and is the first of its kind in SA. This highly anticipated bill, if passed, will form an integral part of the country's environmental law framework and will have far-reaching effects on all spheres of government, and businesses. Adaptation to the effects of climate change is an important part of any climate change mitigation strategy. As such, the bill also envisages the creation of national and sector adaptation strategies and plans. These will be informed by adaptation scenarios to be developed by the minister which will anticipate the affects and vulnerabilities associated with climate change in SA. The purpose of these measures is to reduce the vulnerability of our economy, society and environment and to strengthen our resilience and adaptive capacity to the adverse aspects of climate change. The bill will also affect business on a large scale. The minister will develop a national GHG (greenhouse gas) emissions trajectory, which will specify a national greenhouse gas emissions reduction target. Based on this trajectory, the minister, in consultation with the relevant ministers for each sector, will publish a list of greenhouse gas emitting sectors and sub-sectors which will be subject to sectoral emissions targets. The minister must also publish a list of greenhouse gas emitting activities. People who conduct greenhouse gas emitting activities and exceed a threshold to be determined by the minister will be assigned a carbon budget — that is an allowed quantity of GHG emissions over a prescribed period. They must submit a greenhouse gas mitigation plan for approval by the minister. However, the bill's enforcement provisions are ineffective. While the failure to submit a greenhouse gas mitigation plan may result in a fine of up to R5m or imprisonment of up to five years for a first offence and up to R10m or imprisonment up to 10 years on a second offence. These fines are inconsequential to many of SA's largest emitters. There is also no penalty for exceeding a carbon budget. Organs of state, provinces and municipalities also face no express consequences for failing to implement the duties the bill places on them. If SA is serious about addressing climate change and transitioning to a low-carbon economy, it needs a bill that will be realistic and sensitive to our developmental challenges, but which can also be effectively enforced. Our climate change response has made important strides in the past years. However, the scientific consensus is that the world can no longer afford to be lax on mitigation measures. SA has tremendous opportunities for renewable energy, but it needs a bill that is not toothless, with stronger penalties for non-compliance in GHG emissions and mitigation plans. • Karberg is an associate at Werksmans Attorneys"
8,South Africa,10 March 2024,https://www.businessday.co.za/bt/opinion/2024-03-10-zumi-njongwe-not-so-sweet-climate-change-has-cocoa-in-crisis/,ZUMI NJONGWE: Not so sweet: climate change has cocoa in crisis,"Navigating the cocoa crisis: balancing profitability and sustainability In recent years, inflation has surged in many economies, impeding economic growth and impacting consumer choices. This inflationary trend significantly affects the food and consumer sector, leading to food insecurity locally and globally. Meanwhile, the cocoa industry faces unprecedented challenges, particularly with soaring cocoa prices and supply shortages. These developments have profound implications not only for chocolate manufacturers but also for millions of cocoa-farming families worldwide, whose livelihoods depend on this commodity. The situation is exacerbated in Ivory Coast and Ghana, the leading cocoa producers, where excessive rainfall has hampered output and delayed harvests. This shortfall has propelled wholesale cocoa prices in New York to their highest levels in 46 years. According to Maxar Technologies, total precipitation in West Africa has exceeded the 30-year average, compounding the damage to cocoa yields. Ghana anticipates its lowest output in 13 years, while Ivory Coast expects its smallest harvest in seven years. Together, these countries account for about 60% of the world's cocoa production. The surge in cocoa prices has led to fluctuations in the shares of major chocolate companies such as Nestlé and Mondelēz, impacting their earnings growth projections. Experts attribute this price surge to various factors, including adverse weather conditions affecting cocoa crops in West Africa, particularly strong harmattan winds damaging cocoa trees. Innovative solutions will be needed to ensure a stable and sustainable future for cocoa-farming communities worldwide These market dynamics are reflected in the futures market, where benchmark London and New York cocoa futures have hit record highs. Industry stakeholders, including exporters and pod counters in cocoa-producing regions such as Ghana, are concerned about the significant drop in output for this season compared with previous years. Addressing the cocoa crisis and ensuring a sustainable future for cocoa-farming communities requires more than just changing farming and production methods. It also involves reshaping consumer preferences towards more sustainable options. Studies indicate that around 65% of consumers are inclined towards making choices that contribute to a more sustainable lifestyle. To meet this demand, food producers, suppliers and retailers must make sustainable options easy, affordable, and attractive. This involves overcoming barriers such as price and availability and ensuring that sustainable options are as tasty and appealing as less sustainable alternatives. Innovation, reformulation, and the use of quality ingredients are essential in achieving this balance. A recent Reuters cocoa poll forecast a global deficit in the cocoa market for the 2023/2024 season, indicating a third successive supply deficit. This deficit is expected to exacerbate the challenges faced by chocolate manufacturers and consumers alike, raising questions about the sustainability of cocoa production and the potential implications for future supply and prices. In addition to cocoa, other soft commodities such as sugar and coffee have also experienced price fluctuations, reflecting broader trends in the agricultural commodities market. These developments underscore the interconnected nature of global commodity markets and the challenges faced by producers, traders, and consumers alike. Despite these challenges, the Nestlé income accelerator programme represents a promising step towards addressing the underlying issues in cocoa farming and fostering sustainable practices. Aligned with the findings and recommendations of the recent World Economic Forum report, this programme aims to improve sustainable cocoa production while further improving the lives of farmers and their families. However, as the cocoa industry grapples with supply shortages and price volatility, broader collaboration and innovative solutions will be needed to ensure a stable and sustainable future for cocoa-farming communities worldwide. This collaboration will allow us to drive positive impact for consumers, cocoa farmers, communities and the planet. The climate crisis is having a profound effect on the continent, with many communities facing significant challenges related to food security. Rising temperatures, changing rainfall patterns and increased frequency of extreme weather events are contributing to decreased crop yields and increased food prices. Addressing these challenges requires a co-ordinated and sustained effort involving governments, non-governmental organisations, the private sector, and local communities. By investing in sustainable agriculture practices, modernising agricultural infrastructure, and promoting public-private partnerships, we can ensure food security and sustainable growth in Sub-Saharan Africa and beyond. The private sector plays a critical role in addressing these challenges. Companies can support sustainable agricultural practices by investing in research & development, developing sustainable supply chains, and supporting local farmers. By leveraging the strengths of each sector and working together, we can build a more resilient and sustainable future for cocoa-farming communities and tackle the broader challenges posed by climate change in Africa and beyond. • Njongwe is business executive officer: confectionery, Nestlé East & Southern Africa Region"
9,South Africa,15 October 2023,https://www.businessday.co.za/bt/business-and-economy/2023-10-15-climate-change-could-cost-5-trillion-globally/,Climate change could cost $5-trillion globally,"A report says extreme weather events centred in Greater China may lead to the biggest losses, of $4.6-trillion. Global economic losses could reach $5-trillion (about R283-trillion) under a “plausible increase” in extreme weather events linked to climate change that cause crop failures and food and water shortages, insurance marketplace Lloyd's of London said this week. Lloyd's, which carried out the research alongside the Cambridge Centre for Risk Studies, stressed that its “systemic risk scenario”, which models the global economic impact of extreme weather, was hypothetical. But it said the work would improve business and policymaker understanding of their exposure to critical threats such as extreme weather. When adjusting the estimated $5-trillion in losses over a five-year period for the probability of those extreme weather events occurring, the expected global economic losses were $711bn, Lloyd's said. “The global economy is becoming more complex and increasingly subject to systemic threats,” said Trevor Maynard, executive director of Systemic Risks at the Cambridge Centre for Risk Studies. He added that the research would “help businesses and policymakers explore the potential impacts of these scenarios”. Lloyd's modelled global economic losses of extreme weather events by estimating the effect of food and water shocks on global GDP over a five-year period. The weighted average loss across the three severities it modelled — major, severe and extreme — was $5-trillion over the five years, ranging from $3-trillion in the lowest severity scenario up to $17.6-trillion in the most extreme. Lloyd's also modelled for events concentrated in regions — it said extreme weather events centred in Greater China would lead to the biggest losses, of $4.6-trillion. The Caribbean region would lose 19% of its GDP over five years if the extreme weather events were concentrated there, Lloyd's estimated."
